,Unnamed: 0,sentence,prob_?,prob_+,prob_-
1599,1599,"Рагим всеми этими качествами обладает, помимо этого мой менеджер всегда создаёт для меня условия, в которых я действительно чувствую себя участником программы «привилегия», в отличии от других менеджеров и это осень важно для меня.",0.0001326656,0.9997675,9.9818586e-05
1600,1600,Сегодня 22 сентября - а счет так и не открыт!,5.9435042e-05,2.2129609e-05,0.99991846
1601,1601,"Оформил мне дебетовый продукт - теперь я обладаю очень выгодной картой для переводов на счета в другие банки, что мне актуально.",0.8462283,0.153561,0.00021070305
1602,1602,"Притом претензию не закрывает, говорит вопрос решится в ближайшее время.. Глубоко разочарована качеством обслуживания, некомпетентностью сотрудников, низкой скоростью работы, непрозрачностью действий банка.",4.271343e-05,2.6069018e-05,0.9999312
1603,1603,"Хочу отметить хорошую работу сотрудников с физическими лицами и поблагодарить, особенно выделю Сергея - если попадаешь к нему ""праздник души"", получаешь квалифицированную помощь, быстро, четко и вежливо.",4.4947927e-05,0.9998951,5.9965812e-05
1604,1604,"Знаете, - с неожиданным энтузиазмом добавляет она: идите на Думскую, там точно есть, я вам гарантирую - сама там вчера целый день отработала, там их навалом... идите, они до 21 ч. работают!",0.99942183,0.00035113047,0.00022710243
1605,1605,"Банк не имеет права вести себя так, как вышеуказанный представитель банка, тем более вести себя так НЕ с клиентами банка.",5.050612e-05,2.5428279e-05,0.99992406
1606,1606,Пишу свою «душещипательную» историю как Сбербанк  плюёт на своих клиентов и не хочет/не желает решать проблемы.,4.7181507e-05,2.5112e-05,0.99992776
1607,1607,"Спасибо компанде Тинькоф, что сделали такие удобные человекческие, доступные каждому инвестиции!",4.6091915e-05,0.9998969,5.699272e-05
1608,1608,но это самое настоящее неуважение к клиентам!,4.533155e-05,2.668933e-05,0.999928
1609,1609,"После того как мне пришлось взять несколько неоплачиваемых выходных на работе для беготни за справками и потраченной на оценку и справки 10, мне пришел холодный немотивированный отказ, без всяких комментариев.",4.2439206e-05,2.783319e-05,0.99992967
1610,1610,Все сотрудники работают отвратительно.,4.4967222e-05,2.9280243e-05,0.99992573
1611,1611,И нет смысла даже подходить к телефону!,4.7914342e-05,2.3869585e-05,0.99992824
1612,1612,У меня были абсолютно все продукты банка которым я успешно пользовался.,0.00070460275,0.99926597,2.9413826e-05
1613,1613,Начальница отделения выбежала и начала при полном зале материться на своих подчиненных... Настолько неграмотной кадровой политики и отсутствие системы обучения персонала я не встречал ни в одном банке.,4.2815256e-05,2.6205136e-05,0.999931
1614,1614,"С первой девушкой говорил 5 минут(ожидание звонка 6 минут) она переключила на другую девушку сказала что передаст мой вопрос ей, но 2я девушка была не информирована об проблеме(ее я ждал тоже минуты 3) потом она после всего сказала что меня переключит на специалиста по притензиям, и сказала что это переключение будет сразу я переспросил точно сразу, на что она мне сказала что уже соединяет и отключилась (ожидание следующего специалиста было 9 минут) тут я стал еще злее, что мне очень не понравилось.",4.423202e-05,2.4907911e-05,0.99993086
1615,1615,"Метелкина Инна- специалист по МСБ, в любое время, по любому вопросу – на все даст ответ, спасибо ей.",5.1402756e-05,0.9999118,3.6775502e-05
1616,1616,Я попала в очень неприятную ситуацию!,9.871711e-05,2.8141054e-05,0.99987316
1617,1617,Просто отлично - клиент должен приходить и еще делать работу сотрудников банка!,7.911461e-05,3.104967e-05,0.99988985
1618,1618,Надеюсь на долгое и приятное сотрудничество.,0.16169804,0.83768547,0.0006165214
1619,1619,"Мощная и продвинутая организация, которая внедряет новые технологии для широкого применения.",5.181564e-05,0.99989736,5.08305e-05
1620,1620,"И тут был совершен долгожданный звонок управляющему, который явно успокоил своих сотрудников, после чего они вежливо (вежливость до этого отсутствовала, у одного из сотрудников, так совсем напрочь) заверили меня, что вопрос будет решен.",0.00012463651,2.9408593e-05,0.999846
1621,1621,"Очередь в 20 человек, на которых сотрудникам плевать.",7.4400516e-05,3.1910822e-05,0.99989367
1622,1622,"Особенно возмущает, почему менеджер посточнно говорит ложную информацию и не несет за это ответственность!",4.3004387e-05,2.6192087e-05,0.99993074
1623,1623,"Мое заявление было рассмотрено и мне утвердили и новую повышенную ставку по вкладу, не расторгая его, и сохранили также возможность иметь бонусы в размере 1,5% от суммы внешних переводов, направленных на пополнение вклада!",0.24515112,0.7441904,0.0106585305
1624,1624,"Постоянно по 100 раз переключают с одного на другого сотрудника, и кормят завтраками.",4.987692e-05,3.187605e-05,0.9999182
1625,1625,"Приятное обслуживание без очередей для клиентов отдела ""Привилегии"".",8.2803745e-05,0.9998828,3.4379096e-05
1626,1626,"Утверждаю, что договор подделан, я не оформлял данный потребительский кредит, в моем отношении проведено мошеннические действия и требую списать с меня данную задолженность, а также дать соответствующую справку о снятии задолженности в Национальное бюро кредитных историй.",0.00011079678,2.2670467e-05,0.9998665
1627,1627,"На следующий день, гордо так, рассчитываюсь картой в аптеке, а мне POS терминал отвечает - операция невозможна!!!",5.5967215e-05,2.4764751e-05,0.9999193
1628,1628,Отвратительная организация работы по принятию и обработке исполнительных листов от взыскателей.,5.080779e-05,2.3697616e-05,0.9999255
1629,1629,Как Вы мне ее навязали так и уберите.,5.6288867e-05,2.3414885e-05,0.99992025
1630,1630,"Приятно общаться и сотрудничить, быть личным клиентом у этого специалиста.",6.525261e-05,0.99988043,5.4296124e-05
1631,1631,"А ситуация, возникшая у меня с промсвязьбанком просто возмутительна и, на мой взгляд, не соответствуют статусу банка, стремящегося поддерживать свой положительный имидж среди своих клиентов.",4.3040578e-05,2.810692e-05,0.99992883
1632,1632,"Хотя я использовал пока только 3 из них (Контакт, Связной и банкоматы).6) Хорошие отзывы по поводу поддержки по телефону и возможность большинство вопросов уладить дистанционно.",8.1965765e-05,0.9998859,3.2107593e-05
1633,1633,Данный «банк» категорически не рекомендую к сотрудничеству.,4.1285763e-05,3.1442087e-05,0.9999273
1634,1634,"После моего обращения мне даже не перезвонили что бы выяснить детали, понятно что вам совершенно это не интересно так как Сбербанк не страдает от нехватки клиентов, и даже не потрудились в ответе правильно указать ИМЯ мужа.",4.1692994e-05,2.5972317e-05,0.9999323
1635,1635,"В итоге это оказалась кредитная карта с лимитом 55 тыс.рублей,которая не нужна и при этом,агент не выдал пакет документов к этой карте.это ещё одно нарушение со стороны банка.",5.015264e-05,2.3436522e-05,0.99992645
1636,1636,"Я прошу «Тепло», а мне оформляют какую-то другую и лгут в глаза, что я не просил именно «Тепло», что час назад я просил, якобы, непонятно что и недвусмысленно намекают, что я идиот.",4.7509006e-05,2.2531713e-05,0.9999299
1637,1637,"Кассир Аделя Ч.  встретила нас с улыбкой, несколько квитанций провела очень быстро.",5.625562e-05,0.9999083,3.5412708e-05
1638,1638,"А денег ни копейки я снять так и не смог... Я отказался и сказал, что меня такая позиция банка не устраивает, и я просто не хочу больше иметь с ним дела.",4.6240257e-05,2.3261397e-05,0.9999305
1639,1639,спасибо от Сбербанка на Рождество!,0.99943024,0.00040142206,0.00016836851
1640,1640,"Очень приветливый, вежливый прием, понятная консультация, всегда можно позвонить и задать интересующий вопрос, не будут по сто раз переключать от одного сотрудника на другого.",7.494332e-05,0.9998902,3.483593e-05
1641,1641,"в10-45 пришло СМС от МТС-банка, что одобрена карта с кредитным лимитом 20 т.р. В 10-45 пришло второе СМС с подтверждением, что доставка будет осуществлена 17.09.19г.",0.999295,0.00027620848,0.00042875216
1642,1642,На запрос нотариуса они ответили что счетов и денег нет!!!,0.00035350982,3.0539955e-05,0.9996159
1643,1643,"И ещё хотелось бы сказать Наталье Андреевне большое спасибо не только как специалисту банка, но и как человеку (за её внимательность и душевность)!",4.6883135e-05,0.9998808,7.237411e-05
1644,1644,Во всех других я просто разочаровалась.,7.50139e-05,4.1326777e-05,0.99988365
1645,1645,"Дожидаюсь оператора, который говорит, что у нас зависла система и НИЧЕГО мы вам сделать не сможем, перезвоните через полчасика...17:35 иду в отделение, стою к операционисту, показываю ей это всё, она тоже ничего не понимает (мол, откуда -16000).",4.4977056e-05,2.328917e-05,0.9999317
1646,1646,"Кроме того, я требую, чтобы в данную ситуацию вмешалось руководство Сбербанка, потому что был выпущен продукт, которым не умеют пользоваться Ваши же сотрудники!",4.9040493e-05,2.5583062e-05,0.9999254
1647,1647,"В январе бронировала на сайте booking.com отель, оплата за который должна была производиться на месте и отмена бронирования происходит бесплатно прям аж за день до заселения (06.02.17).",0.99759585,0.002231958,0.00017217883
1648,1648,Но в целом по уровню сервиса очень доволен.,5.3017622e-05,0.99991095,3.602526e-05
1649,1649,Хочу искренне ее поблагодарить и надеюсь впредь буду попадать в чатах именно на нее )),0.00010782608,0.99983764,5.451696e-05
1650,1650,"Ни один специалист в банке не отвечает за свои слова... ни в разговоре, ни на бумаге и вы должны осознавать каждый свой шаг, чтобы не попасть в очередную ловушку.",5.0049883e-05,2.3124067e-05,0.9999268
1651,1651,"Сидя на колючих диванах этого ""супер-пупер"" офиса я наслаждался каналом РБК, искусственным венком на столе и давнишним номером (по-моему, апрельским) Forbes.",6.3526764e-05,2.5220785e-05,0.9999112
1652,1652,"И самое негативное отношение к банку, в котором обслуживаюсь вот уже 10 лет.",5.921839e-05,4.4500557e-05,0.9998963
1653,1653,Это просто неуважение  к клиенту!,4.6654888e-05,2.620721e-05,0.99992716
1654,1654,После такого наглого обмана ни копейки им не доверю.,4.8156464e-05,2.4145435e-05,0.99992764
1655,1655,"Очень спокойные и лояльные сотрудники, все это на личном опыте , пользуюсь пользовалась и буду пользоваться, очень всё удобно.",7.828294e-05,0.9998934,2.8217813e-05
1656,1656,"В связи с тем, что Банк заслужил моё доверие и нравится офис, в котором я обслуживаюсь, решил здесь приобрести подарки друзьям (монеты) к Новому году для друзей, коллег и партнеров.",0.00024033432,0.99968755,7.2080365e-05
1657,1657,А ведь это ещё и нарушение закона - задержка алиментных платежей при наличии денег на счету.,6.411575e-05,2.460058e-05,0.9999113
1658,1658,"Это самый отвратительный банк, ни в коем случае не открывайте здесь счетов!",3.9768463e-05,2.6464139e-05,0.9999337
1659,1659,"В конечном, счёте всем довольны!",6.8524714e-05,0.999895,3.6480873e-05
1660,1660,"Списание можно будет подтвердить операцией прошедшей в марте 2013 года по карте, полученной в Москве.07.04.14 с целью урегулировать данный вопрос я приехала в Москву и обратилась в Сбербанк находящийся у Курского вокзала по адресу ул. Земляной вал дом 24/30.",0.9995757,0.00020418409,0.00022004981
1661,1661,"Приехав сегодня 4.06.2018 в это же отделение для подачи заявления нас встретила та же хамовитая сотрудница Сп-ва А. Н. и с порога начала хамить, но все же с большим скандалом и оскорблениями у нас приняли заявление на отказ от сертификатов ""Финансовый помощник"".",5.2420455e-05,2.4887286e-05,0.99992263
1662,1662,Благодаря им открыл чудесный ресторанчик The ФИШ на Ленинградке (с 30% кешбеком вообще сказка).,8.9502966e-05,0.9998596,5.0932224e-05
1663,1663,"Мне очень повезло, потому что на следующий день позвонил и мне сообщили, что деньги уже в доступном остатке.",8.913195e-05,0.9998789,3.19904e-05
1664,1664,Пользоваться для оплаты в интернет невозможно!,7.035292e-05,2.6159318e-05,0.99990344
1665,1665,"Посмотрела на покупателя, он стоял спокойный и уверенный.",0.14488575,0.8548554,0.00025888477
1666,1666,"Вывод один, что операторы очень плохо обучены и не могут ответить грамотно ни на один вопрос, а главное - не могут правильно составить обращение и направить его, что важно, в правильное подразделение.",4.5086203e-05,2.6575834e-05,0.99992836
1667,1667,Требую немедленно закрыть мой карточный счет или объяснить причину проволочки!,0.0001375806,3.0605894e-05,0.9998318
1668,1668,Ставки по вкладам вполне на уровне.,0.00012900167,0.99982005,5.1055285e-05
1669,1669,Уберите тогда с сайта своё предложение!,5.783133e-05,2.278127e-05,0.9999194
1670,1670,"Я, если честно, в шоке от того, как легко Сбербанк теряет документы, от того, как халатно сотрудники Сбербанка относятся к своим обязанностям, работая с чужими деньгами.",6.6846136e-05,3.0183122e-05,0.99990296
1671,1671,"Невозможно отмотать месяц-другой назад (страницы перескакивают сразу на несколько месяцев - явно, что это неполадки разработчиков), страница трясётся и прыгает под тач-скрином.",6.463916e-05,2.3638062e-05,0.99991167
1672,1672,"Во-вторых, приятно общаться с сотрудниками: всегда доброжелательное отношение, стараются проинформировать об изменениях и посоветовать лучшую стратегию.",5.0014754e-05,0.9999113,3.8658098e-05
1673,1673,"Обслуживание очень понравилось, девушка на Ленинском подробно проконсультировала как и когда получить ПТС.",6.1007573e-05,0.9999075,3.145523e-05
1674,1674,"Очень неприятная ситуация, надеюсь, банк либо опубликует официальные правила в системе интернет-банкинга (перед платежом) о том, что банк ни за что не отвечает кроме списания денег со счёта, либо будет хотя бы помогать клиенту разбираться с компаниями-партнерами.",5.2715397e-05,2.347319e-05,0.9999238
1675,1675,"Я расцениваю эту ситуацию как обман со стороны сотрудника банка, умышленное не предоставление информации клиенту, впечатление от пользования качественным продуктом банка испорчено.",4.8827802e-05,2.6397809e-05,0.9999248
1676,1676,Организовали банкиры сей процесс - тоже молодцы.,6.864149e-05,0.9998658,6.551116e-05
1677,1677,"Татьяна общалась с нами спокойно, вежливо, доброжелательно и терпеливо, отвечая на все наши вопросы.",5.9829574e-05,0.99990845,3.1748015e-05
1678,1678,"То они мне говорили про безопасность моих средств, а теперь уже сомнительные операции!",7.092885e-05,2.4662731e-05,0.9999044
1679,1679,"На горячей линии отвечают, что у них результат узнать невозможно.",5.4931654e-05,2.356076e-05,0.99992156
1680,1680,они еще передали данные коллекторам которые просто жить не давали и только 13.10.2016 банк признал кредитный договор недействительным.,0.00011348358,2.3478637e-05,0.999863
1681,1681,"Не с первой ссылки, но наткнетесь на что-то, что уже проиндексировал поисковик и если повезет - информация будет относительно свежей.4.",0.9971404,0.00030622422,0.0025534278
1682,1682,"Хочу отметить хорошую работу сотрудников с физическими лицами и поблагодарить, особенно выделю Сергея - если попадаешь к нему ""праздник души"", получаешь квалифицированную помощь, быстро, четко и вежливо.",4.4947927e-05,0.9998951,5.9965812e-05
1683,1683,"И мы отправились восвояси, с твердой верой в надежный банк.",0.94895744,0.050491404,0.0005511668
1684,1684,"Однако отдел по просроченным платежам с завидным упрямством настаивает на том, что платеж на мой РАСЧЕТНЫЙ счет НЕ БЫЛ внесен!!!",5.0251274e-05,2.3226967e-05,0.99992657
1685,1685,"Вызывает большой вопрос тот факт, что в результате своих действий мошенники легко через мобильное приложение Сбербанк-Онлайн смартфона перевели с дебетовой карты деньги, а Сбербанк никак не отреагировал на это.",5.0773324e-05,2.6254529e-05,0.999923
1686,1686,"Первые два сотрудника в чат-банке (Мария и Дарья) как обычно оказались совершенно бесполезны и ничего не смогли объяснить, давая бессмысленные ответы.",4.3499625e-05,3.018118e-05,0.9999263
1687,1687,Я быстро рефинансировал кредит в другом банке - никому не советую связываться с этим монстром.,5.796356e-05,2.4803488e-05,0.99991727
1688,1688,"Никакого уважения, внимания, хоть какой то попытки понять и объяснить суть проблемы.",4.7363617e-05,2.7247108e-05,0.9999254
1689,1689,"На все мои вопросы я получила профессиональные и грамотные ответы, так держать!",5.110723e-05,0.9999099,3.8918464e-05
1690,1690,"Весной я брала в Райффайзене кредит на новую иномарку, ответ дали в срок, положительный!",9.1863614e-05,0.9998784,2.9664727e-05
