,Unnamed: 0,sentence,prob_?,prob_+,prob_-
999,999,14.11.19 в 09-00 я посетила отделение Почта Банк на Привокзальной площади в Саратове с целью подтверждения своей личности для использования учетной записи Госуслуг.,0.99957794,0.00020004992,0.00022205236
1000,1000,"Также задала вопрос о возможности перерасчета, на что сотрудник ответила, что это невозможно штрафы и просрочки выставлены, я ответила, что буду писать претензию на имя директора филиала, сотрудник Ск-ва, хохоча, ответила, что это не поможет!",5.6021057e-05,2.255216e-05,0.99992144
1001,1001,Потеряно полдня абсолютно впустую и деньги на проезд тоже никто не вернет.,4.2555235e-05,2.5062904e-05,0.9999324
1002,1002,"за обслуживание этой Сверхкарты+я опять обратился в банк по этому поводу, номер обращения R19/340-031-780092Сегодня выслушал ответ бака: деньги списаны правильно, вы пописали договор.. ничего не вернем и всё в таком духе.. Вывод - банк откровенно кидает и обманывает своих клиентов.",4.5875462e-05,2.375498e-05,0.9999304
1003,1003,"Управляющая отделением вообще ничего не знает и говорит, что не разбирается в юридических лицах и не знает законодательства!",4.2993004e-05,2.4947665e-05,0.99993205
1004,1004,"Произошла такая ситуация, сегодня обнаруживаю в приложение телекард 2.0 неизвестную карту,на которую я заявку не подавал и выпущена в другом регионе где я уже не проживаю лет так несколько.",5.727474e-05,2.2093325e-05,0.9999206
1005,1005,Всегда аккуратно выплачивала основной долг и проценты.,0.9995183,0.0003413239,0.00014037151
1006,1006,Это приятно .- На остаток по счёту 10% начисляют - это круто!,0.00015105495,0.99979013,5.886875e-05
1007,1007,"Нужен мне такой банк - НЕТ, НЕТ И ЕЩЕ РАЗ НЕТ!!!",4.7768768e-05,2.5545014e-05,0.9999267
1008,1008,"В итоге после полутора месяцев хождений и звонков в банк мне ответили что закладную не вернули , на мои вопросы почему и когда вернут и что делать дали ответ НЕ ЗНАЕМ !",4.217408e-05,2.4633237e-05,0.99993324
1009,1009,Дозвонится по телефону 401-47-92 просто не возможно!,5.7584075e-05,2.4691606e-05,0.99991775
1010,1010,"Но дальше больше: позвонили на новую работу, описали меня как мошенника и уклониста, отъявленного негодяя... С чего это скажите мне, без решения суда, без предъявления официальных претензий эти люди оскверняют меня в глазах работодателя?!",4.276036e-05,2.4745059e-05,0.9999325
1011,1011,"На сообщение в чате не отвечают, по телефону опять переключают на бесконечную музыку.",4.3770186e-05,3.0118661e-05,0.9999261
1012,1012,И этими звонками просто мотают мне нервы!,5.667925e-05,3.2311873e-05,0.99991095
1013,1013,"НЕ СОВЕТУЮ ДАННЫЙ БАНК, Мою проблему они не слышат и я хочу хоть как то до них достучаться!",4.376602e-05,2.4168463e-05,0.99993205
1014,1014,Очень приятно было с вами работать!,5.2374162e-05,0.9999051,4.250828e-05
1015,1015,"Операторы бестактные, не смогли даже извинится от лица банка за данную ситуацию.",5.044615e-05,2.5298492e-05,0.9999243
1016,1016,"После того, как мы сказали, что данные фотографии имели для нас ценность, она, хлопая глазами, сказала, что ваш телефон счел это мусором!",7.170523e-05,2.5532274e-05,0.9999027
1017,1017,"Выбор категории кешбека появился только ближе к вечеру 1 октября, и при этом отображалось что действовать новая категория будет только с 1 ноября, а до этого действует категория 4% на всё.",0.9993789,0.00029312735,0.00032802823
1018,1018,"Дозвониться в офис невозможно, телефон у них устроен странным образом, что если линия занята, то клиенту идут гудки, что не берут трубку.",4.2025888e-05,2.5696429e-05,0.9999323
1019,1019,У меня были абсолютно все продукты банка которым я успешно пользовался.,0.00070460275,0.99926597,2.9413826e-05
1020,1020,"Люди, я прекрасно умею читать!P.S.",0.99956745,0.00028272404,0.00014973519
1021,1021,Некомпетентность операторов зашкаливает!!!,6.619374e-05,2.804017e-05,0.9999057
1022,1022,"Как итог: Сбербанк самый клиентоориентированный, оперативный и надежный банк, всем советую, скучно не будет.",6.174744e-05,0.9998915,4.668696e-05
1023,1023,"Техподдержка никак не помогает, ибо у них связи с челябинским филиалом просто нет!",4.471685e-05,3.598734e-05,0.9999193
1024,1024,"Чтобы не докучал томными вопросами... Не первый банк, с кем работаем, но такое отношение впервые и до этого счета банки самовольно не блокировали.",4.755983e-05,2.338887e-05,0.9999291
1025,1025,"Потому, что к мою глубокому сожалению, Ваши работники, которые работают в офисах Будущего, не могут предоставить данную информация и меняют свое мнение слишком часто, а вызов нотариуса на до стоит не маленьких денег!",5.6692723e-05,2.5537529e-05,0.99991775
1026,1026,Выражаю благодарность работникам Совкомбанка за небезразличное отношение к людям.,4.8197566e-05,0.99989676,5.508321e-05
1027,1027,"Мы забираем платежное поручение, через МФЦ подаем документы на наложение обременения в Сбербанке (до момента оформления 5 пункта, пользование кредитом обходится для нас по повышенной процентной ставке).6.",0.9993006,0.00019120271,0.00050817704
1028,1028,"Но тиньков-банк настолько упростил свои формы платежных поручений, что перечисление платежей во многие бюджетные учреждения невозможно.",5.723752e-05,3.4189365e-05,0.99990857
1029,1029,"Надеюсь Вы достойно оцените труд Ирины Евгеньевны, ее профессионализм и честную, добросовестную работу.",8.627986e-05,0.9998585,5.5221743e-05
1030,1030,"Великолепное обслуживание, прекрасный банк!",5.987698e-05,0.99990034,3.9838353e-05
1031,1031,"Хочу сказать, что отвратительная работа банкоматов ""Сбербанка России"" испортила мне все праздничные выходные - очевидно, когда даёт сбои сервис банка, страдать от этого должен в первую очередь клиент.",5.3885153e-05,2.659251e-05,0.99991953
1032,1032,Для данного банка каждый клиент важен!,6.782693e-05,0.9998765,5.5647946e-05
1033,1033,Отвратительное качество обслуживания клиентов.,4.059488e-05,3.639977e-05,0.999923
1034,1034,Обращаю внимание на отвратительную работу отделений и служб Почта-банка.,5.9489288e-05,3.4817767e-05,0.9999057
1035,1035,"Не обращайтесь в Почта Банк, это Банк который против людей, который не идет на встречу своим клиентам, а загоняет их в еще более тяжелое материальное положение.",4.053471e-05,2.7284037e-05,0.99993217
1036,1036,- 3 летний очень выгодный вклад.,0.00024798771,0.99970657,4.5401892e-05
1037,1037,не могут разобраться с моей жалобой (ни ответа - ни привета).,5.242888e-05,3.1072297e-05,0.99991643
1038,1038,"Так же банк отказывается списывать долг, тем самым не исполняет решение Арбитражного суда.",6.310267e-05,2.4233124e-05,0.9999126
1039,1039,"Отвратительное отношение к клиентам, отвратительный Банк.",3.914984e-05,2.8501598e-05,0.9999323
1040,1040,"Поддержка  супер, работает всегда: 24/7, 7 дней в неделю, 365 дней в году.",7.271522e-05,0.9998859,4.1407115e-05
1041,1041,"Но вообще, постараюсь максимально быстро закрыть кредит в этом банке и обходить его стороной, отвратительный банк.",4.3827567e-05,2.5577341e-05,0.9999306
1042,1042,"Я, в свою очередь, была весьма приятно удивлена.",0.0009345026,0.9990221,4.3392247e-05
1043,1043,Не работает уже 3 часа - это возмутительно!!!,3.980147e-05,2.8517567e-05,0.9999317
1044,1044,"Большое спасибо сотрудникам отделения банка на метро Багратионовская, особенно П-ву Антону.",4.7545924e-05,0.9999056,4.6865072e-05
1045,1045,"Отвечает приятный голос, не автоответчик, полная консультация, правда, по одному вопросу у девочки не хватило информации и меня переключили на профильного специалиста, как оказалось, разговаривал с начальником подразделения... Отлично.",0.0011514081,0.99463165,0.0042169765
1046,1046,"Почему в банке как Сбербанк если заполняешь заявку онлайн и указываешь что страхование тебе не нужно никто не навязывает никакие услуги и спокойно выдают кредит , в этом же банки ВТБ хотят обмануть людей с ссылаясь что горячая линия не владеет данной информацией и не знает всех условий !",4.040769e-05,2.552655e-05,0.9999341
1047,1047,"Думаю, на основе обслуживания уже на протяжении несколько лет, хоть с некоторой натяжкой, но ""пять"" банку могу поставить.",0.00014030162,0.99970585,0.00015389542
1048,1048,"На сегодняшний день деньги мне не вернули, ответа на жалобу, поданную через сотрудника отделения, нет.",4.9263665e-05,2.5328864e-05,0.9999254
1049,1049,"и еще одна девушка, которая ничего не умеет и постоянно все спрашивает у другой, а не нее уже накинулся другой недовольный клиент, который тоже хотел внести наличные.",4.5138942e-05,2.4742923e-05,0.99993014
1050,1050,"Думал, закончилось все в 90-х. Открыли учредителю компании дебетовую карту, сотрудник банка дал реквизиты, перечислили туда 80 т. руб. Деньги не пришли, оказалось, что сотрудники банка дали реквизиты совершенно другой карты, своей наверное.",6.65639e-05,2.249884e-05,0.99991095
1051,1051,Никому не советую сталкиваться с этим отделением.,4.5976205e-05,3.0236763e-05,0.9999238
1052,1052,"Очень понравилось, что перед активацией идет предупреждение  клиента о том, что комиссия за годовое обслуживание карты списывается сразу после активации, а не после, скажем, первой операции по карте - все предельно прозрачно, молодцы!",5.6970555e-05,0.9999026,4.0355008e-05
1053,1053,"Чем довольна: отличный кол-центр, не сравнить ни с одним банком, реально люди занимаются твоими вопросами!",6.962006e-05,0.99986124,6.909955e-05
1054,1054,"Юрий подробно разъяснил мне все, что меня интересовало по беспроцентному периоду.. А банк становится еще лучше, несмотря на то, что сотрудники сайта Банки.",7.8870165e-05,0.99987376,4.7374186e-05
1055,1055,"Ответ был очень крутой - ""Да, приходите завтра, т.к. в выходной день при оформлении кредита у нас скидка 2% к базовой ставке"".",0.99889356,0.0008017235,0.00030469135
1056,1056,"У нас в городе очень много других, где стремятся улучшать сервис и четко следят за работой сотрудников.",0.00031390303,8.484484e-05,0.9996013
1057,1057,"Еще раз убедился, что верить банкам нельзя и что им наплевать на людей!",8.391226e-05,2.8107996e-05,0.99988794
1058,1058,"""Отлично""- говорю я. И на следующий день иду в отделение № 9038/01744, так как оно находится рядом с работой.",0.99934846,0.00031447705,0.00033699683
1059,1059,Впечатление максимально положительное.,0.00021024903,0.99974877,4.1049952e-05
1060,1060,"Я понимаю, что крупный банк обязывает работать специалистов по скриптам, чтобы оптимизировать решение вопросов, но всегда должна быть возможность работать как-то по человечески, когда клиент адекватно аргументирует срочность вопроса.PS для банка: тикет 2497109",0.9908432,0.00036008362,0.00879672
1061,1061,"Это мегамозги, мега профессионалы, которые всегда готовы помочь.",5.7814566e-05,0.9998994,4.2820233e-05
1062,1062,"Все расчеты с контрагентами у нас идут только через ПСБ, без проблем, пользуем PSB-online, удобно красиво, быстро.",8.020761e-05,0.9998845,3.5325917e-05
1063,1063,Спасибо!PS: Рассматривая в целом работу банка - тоже доволен.,6.298474e-05,0.99990153,3.5545574e-05
1064,1064,"Нравится как представлены расходы- в виде цветной линейки, легко просмотреть в какой категории самые высокие траты.",8.415515e-05,0.99987733,3.844634e-05
1065,1065,"Получается меня обманули в офисе, ничего не сказав, ни рассказав, и подсунули на 1 документ больше чем те которые отдали мне?",4.3299988e-05,2.3995266e-05,0.99993265
1066,1066,"С пол года незад открыла себе брокерский счет в Тинькофф банке, пользовалась, и вроде все в порядке, рекомендовала друзьям и знакомым.",5.443025e-05,0.99990904,3.6496138e-05
1067,1067,"Сейчас, еще у кого нибудь отзовут лицензию, все равно прибегут, блин.. Короче, разозлилась за такое хамство   Решила в течение месяца закрыть вклады (при этом ставки на депозиты, в Сбербанке никогда не были ""для народа"", поэтому от этого только выиграю).",5.7560665e-05,2.4101751e-05,0.99991834
1068,1068,"Очень милая и ответственная девочка-гритер все проверила, помогла заполнить номера договоров и распечатала выписки, чтоб корректно рассчитать суммы.",5.8421287e-05,0.99990857,3.299336e-05
1069,1069,"Пошли в отделение 22.02.18г, там все прошло ""на ура"", втюхали страховку, подписали договор, сказали приходить через неделю, позвонили и сказали, что пока не пришла, но кредитный лимит увеличили даже.",0.00016256023,3.5243695e-05,0.9998022
1070,1070,"Ваши Менеджеры не только вводят в заблуждение, не знают нормативов документации и правил, ещё и считать не умеют???",4.2725325e-05,2.6034335e-05,0.9999312
1071,1071,Платежи всегда вносятся вовремя.,0.99905735,0.000871252,7.148566e-05
1072,1072,"ответ один и тот же извините решим проблему.1) Не могу сделать перевод денег ребенку из-за смс пароля, мы зарплатный проект ВАШЕГО банка, работаем на вахте Таймыр медвежий угол, тут ни какая мобильная сеть не ловит!!!",7.676601e-05,2.6097607e-05,0.9998971
1073,1073,Менеджеру даже нет желания звонить!,4.811231e-05,2.8875851e-05,0.999923
1074,1074,"После общения с этим сотрудников, я смело всем рекомендую МТС банк как достойный и благонадежный.",5.5620505e-05,0.999884,6.027596e-05
1075,1075,"Сотрудницы были новыми, приветливыми.",5.4412507e-05,0.99991107,3.4553228e-05
1076,1076,"Отличный сервис,  очень оперативно ответили и быстро решили проблему👍🏼 Большое спасибо  Александру К. за оказанную помощь, все доступно и понятно объяснил, оформил запрос, был очень приветлив   ☺️",4.6792153e-05,0.9999125,4.0678824e-05
1077,1077,"После того, как мы сказали, что данные фотографии имели для нас ценность, она, хлопая глазами, сказала, что ваш телефон счел это мусором!",7.170523e-05,2.5532274e-05,0.9999027
1078,1078,"Всегда вежливые и компетентные сотрудники, всегда лучшие инструменты для бизнеса.",5.1455354e-05,0.99991024,3.8236438e-05
1079,1079,"Отвратительное отношение к клиентам, такое ощущение, что нет ни одного компетентного сотрудника.",3.87509e-05,2.6877671e-05,0.9999343
1080,1080,"В конечном, счёте всем довольны!",6.8524714e-05,0.999895,3.6480873e-05
1081,1081,При наличии клиентов в зале или невозможности ответить на звонок - обязательно перезванивает.,0.0025475263,0.99739456,5.784611e-05
1082,1082,Также банк не предоставляет жалобную книгу!!,6.605593e-05,2.6524685e-05,0.9999074
1083,1083,Я просто в шоке от высокого уровня обслуживания клиентов через интернет.,0.00043934354,0.99853766,0.001022973
1084,1084,"Не пытайтесь валить на операторов мобильных сетей, потому что вовремя не приходят только определенные СМС-ки.",4.5556084e-05,2.6501386e-05,0.9999279
1085,1085,Была очень приятно удивлена скоростью выпуска карты.,5.849229e-05,0.99990726,3.426763e-05
1086,1086,Могу как привередливый клиент перечисленных банков сказать: ТКС банк - лучший!,0.00040483454,0.99939036,0.00020479948
1087,1087,"Звонки в ТП по телефону горячей линии никакого результата не дали и дать априори не могут, поскольку дозвониться в принципе невозможно, идет бесконечный повтор от бота: ""Время ожидания более 7 минут"".",3.8299142e-05,2.6589349e-05,0.99993515
1088,1088,После этого пропадает желание пользоваться услугами Сбербанка!,4.9496324e-05,2.7454278e-05,0.999923
1089,1089,"Сотрудник говорит, что это не в зоне ее компетенции, отсылая на номер 0701, куда целый день невозможно дозвониться!",5.4084743e-05,2.2837063e-05,0.9999231
1090,1090,А ваша карта может неудачно повлиять на это и ничего мне не одобрят ?!?!,5.0905528e-05,2.3467614e-05,0.9999256
1091,1091,И ничего нет (Собственных денег - 0!,0.000120750534,2.9894665e-05,0.9998493
1092,1092,"300 рублей, интернет работает.- Отлично!",0.99899834,0.0008996945,0.000101955215
1093,1093,Не рекомендую полагаться на этот банк.,4.312769e-05,3.07369e-05,0.9999261
1094,1094,"Позвонила опять на горячую линию, опять пароль не выслали, опять договора нет... Ах да, я совершила бесплатную операцию запроса  баланса в ""любом"" банкомате и теперь у меня задолженность 39 рублей, а я ещё даже не успела толком оформить карту)))) Я не то чтобы в шоке, я настолько обескуражена поведением банка, что дальнейшего желания пользоваться его услугами нет никакого.",4.7102614e-05,2.3003933e-05,0.9999299
1095,1095,"Обратная связь с банкои отвратительная, там мне в первый раз сказали, что составят обращение, а во второй раз сказали звоните в магазин, больше мы вам ничем помочь не можем.",3.9505565e-05,2.5816531e-05,0.9999347
1096,1096,"Ужасное обслуживание, в том числе премиальных клиентов.",5.139452e-05,2.7257187e-05,0.9999213
1097,1097,"Показала неверную сумму переплаты по кредиту, заведомо скрыв реальную стоимость страхования.",8.599827e-05,2.291515e-05,0.99989104
1098,1098,Это я называю качественным и хорошим сервисом обслуживания.,5.8546037e-05,0.99988735,5.4073884e-05
1099,1099,"В итоге консультации поверхностные и не по теме, в связи с этим сделала вывод, что сотрудники не компетентны, также не знают законодательства, не хотят работать.",4.2987074e-05,2.558439e-05,0.99993145
