,Unnamed: 0,sentence,prob_?,prob_+,prob_-
500,500,"Вполне возможно, ты и не так плох, каким запомнился.",0.99947006,0.00043117622,9.873727e-05
501,501,Хочу сказать что РС действительно современный банк - Интернет Банк и Мобильный банк очень удобны и многофункциональны.,5.3340955e-05,0.999897,4.963751e-05
502,502,"Ура, попала на адекватного сотрудника.",8.0789105e-05,0.99986506,5.415556e-05
503,503,"При обращении за получением наличных (30 мая около 17 часов вечера) в отделение «Романов двор» я уточнил сроки инкассации пластиковых карт и мне сообщили, что этот срок может составить до 10 рабочих дней.",0.9994885,0.00023712947,0.00027438044
504,504,"Перевод от 24.05 был обработан 27.05 и после, с остатком 11 копеек, не было больше никаких транзакций по карте ""Отличная"".",0.00016459267,3.05805e-05,0.9998048
505,505,"Короче ложь на лжи... И ещё, обед отделения на Петербургской 88, только для юридических лиц с 13 до 14 часов, но я лицо физическое так и просидел час с лишним, в ожидании одного из двух кредитных специалистов.",4.8919675e-05,2.5193965e-05,0.99992585
506,506,"Отличный банк, я оформила карту халва, и так как я пенсионерка теперь за покупки по карте от 5000 рублей в месяц, мне начислят кешбэк в 6% реальными деньгами на мою карту халва, которыми я могу ра плачиватьсч во всех магазинах.",0.00011361922,0.9998436,4.27869e-05
507,507,"Договориться они вдвоем не смогли, при том, что девушка из РЖД уверенно говорила, что это проблема Банка, а девушка из отделения Банка что-то мямлила, что у них нет технически такой возможности.",5.68127e-05,2.2764047e-05,0.99992037
508,508,"Позже я убедился, что процент на остаток средств действительно начисляется – без дураков, а еще начисляется кэшбэк за покупки, что вообще очень приятно.",0.00011172391,0.99985397,3.4375946e-05
509,509,"Хорошо поставленный голос, точное знание матчасти, умение слушать клиента и желание ему помочь.",6.5888926e-05,0.99989164,4.2476386e-05
510,510,"Все поначалу было хорошо, офис недалеко от работы, да и система переводов Contakt работала исправно (переводила с работы по данной системе платежи).",9.637487e-05,0.9998777,2.5857882e-05
511,511,"Получил страховую выплату от АСВ, зашел открыть вклад в Кредит Европа Банк, так как на данный момент мне показались условия по вкладам в этом банке одними из самых интересных в Москве.",7.855686e-05,0.9998789,4.255978e-05
512,512,"Меня полностью устраивает обслуживание в Тинькофф Банке моей дебетовой карты - реальные большие проценты за деньги в режиме вклада ""до востребования"", отсутствие очередей как в сам банк (ввиду отсутствия офисов), так и в банкоматы, потому что снять деньги без комиссий можно в любом банкомате любого банка!",6.6158456e-05,0.9998952,3.86249e-05
513,513,"Они могут прийти домой с непонятными картами, кредитами, ипотекой и еще какой-нибудь платной услугой Сбербанка!",5.1950883e-05,2.3748062e-05,0.9999243
514,514,Неприятно разочарован неумением работать с клиентами.,4.2314106e-05,2.748245e-05,0.99993014
515,515,"Самый лучший банк, ещё раз убедилась!",0.00012772379,0.99982125,5.102322e-05
516,516,"Клиентам Альфы рекомендую задуматься о том, что не везде в России с вами будут так обращаться в банке, а время и деньги можно тратить на другие занятия, кроме визитов в банк.",9.4361654e-05,4.8996917e-05,0.9998566
517,517,Александра всегда готова ответить на вопросы и помочь.,6.362627e-05,0.9999057,3.0657644e-05
518,518,Они же потеряли мои документы?» Я получил ответ: «Мы ничего исправить не можем!»  Тогда я попросил вызвать для выяснения сложившейся ситуации руководителя Отдела сопровождения – М-нову Дарьяну.,0.00010974859,3.064822e-05,0.9998596
519,519,"Конечно, отделение же до девяти работает – в 21:00 самим надо домой идти!",0.0007018882,9.088449e-05,0.9992072
520,520,"В чате поддержки написали, что вроде как всё справедливо.",0.99954,0.00033361904,0.00012646844
521,521,"Так что никому не советую связываться с этим  банком, максимум зарплатный клиент.",4.604956e-05,2.7536418e-05,0.99992645
522,522,"Я потом не сразу поняла, что это из ""совка"" звонили… в таком была шоке!",6.0545066e-05,2.401042e-05,0.9999155
523,523,Хочу отметить и службу безопасности.,6.191996e-05,0.99988925,4.8922506e-05
524,524,"Мария, ещё раз, спасибо огромное Вам, и конечно, менеджерам Домклик, за проделанную работу",4.7956637e-05,0.99989414,5.788135e-05
525,525,"Возникла ситуация с Вашим банком, а именно заблокировали с утра дебетовую карту, пришел в отделение возле метро Чертаново, попросил узнать почему заблокировали, на что мне ответили, что такой информации не владеют, пишите заявление, где карту получали.",8.9403955e-05,2.485212e-05,0.9998857
526,526,"Подводя итог хочу сказать, что у сотрудников сбербанка, просто наплевательское отношение к их клиентам, и служба поддержи клиентов тоже не работает.",4.6040375e-05,3.5324625e-05,0.9999186
527,527,"Хочу поблагодарить менеджера П-у А. А. за компетентность, внимательность к клиенту , заинтересованность в решении вопроса и доступность информации.",4.23243e-05,0.9998944,6.3239124e-05
528,528,"это займет еще 1 месяц, так вот кредитный инспектор Ирина Валерьевна,ф-не знаю, очень неответственнй инспектор-2 месяца тянуть и не сказать что же им конкретно нужно, ушла в отпуск, не дождавшись одобрения или отказа в одобрении данного объекта,  НЕ ХОДИТЕ В ЭТОТ БАНК НИКОГДА!!!!!",4.320589e-05,2.4351037e-05,0.9999324
529,529,"Я была крайне удивлена, т.к. никаких кредитов и тем более кредитных карт я не оформляла вообще никогда.",0.79241675,0.0017349013,0.20584825
530,530,Для меня это лучший банк в России!!!,6.2649786e-05,0.999889,4.8251233e-05
531,531,Очень порадовала оперативность и четкость в работе.,4.8676884e-05,0.9999143,3.7051734e-05
532,532,"Первое знакомство... Вход в ИБ без ввода СМС, проведение операций без смс - успешно.",0.8691859,0.1303348,0.00047929594
533,533,"Персонал абсолютно адекватный, понимают специфику нашей работы (частые срочные переводы и не всегда по России) и стараются помочь, тратя на это свое личное время.",6.5140564e-05,0.99990046,3.450324e-05
534,534,"Отвратительное отношение к клиентам, отвратительный Банк.",3.914984e-05,2.8501598e-05,0.9999323
535,535,"В течении нескольких минут получил полноценную обратную связь, несмотря на большую разницу во времени (Москва/Владивосток).- Мгновенное реагирование на вопросы пользователей, что очень приятно.- Вдвойне приятно получать обратную связь не от бота, а сотрудника банка.- Разница в часовых поясах Москва/Владивосток не стала препятствием для быстрого решения проблемы.",6.9992595e-05,0.9998956,3.4443532e-05
536,536,"Но самое главное, спустя 8 дней деньги так и не пришли на счет и на счету потерянных сумм этих денег нет!",4.709123e-05,2.448304e-05,0.9999285
537,537,"По моему мнению, политика ВТБ абсолютно неклиентоориентирована и направлена на то, чтобы добросовестные заемщики оформляли рефинансирование существующих кредитов в других банка, где помимо более высокой скорости обслуживания, еще и более привлекательная ставка, чем та, до которой обещает снизить ВТБ.",4.7557434e-05,2.7929966e-05,0.99992454
538,538,"В частности, купюры могут быть изношенными, грязными, с масляными пятнами, штампами, надписями, дырками, склеенными, залитыми краской, оборванными и бракованными.",0.00011572616,2.77473e-05,0.9998565
539,539,"Из плюсов хочу отметить:- очень удобный мобильный банк (даже удобнее, чем интернет-банк): на мой взгляд, лучшее из всех подобных приложений, которыми я пользуюсь (а мне есть с чем сравнивать);- хорошая работа службы безопасности: как-то расплатилась картой в Париже, мне через минуту перезвонили, чтобы убедиться, что это я, а не мошенники;- широкая сеть отделений и банкоматов (жаль только, что в связи с реструктуризацией большинство отделений перестали работать по выходным)- хороший call-центр: дозвониться можно за пару минут, консультируют всегда хорошо, проблему обычно решают- из Банка ни разу не звонили и не навязывали никаких кредитов.",5.6700985e-05,0.99989367,4.9606253e-05
540,540,Специалист ГР-Н-вопиющая некомпетентность!!!,4.8874146e-05,2.5572723e-05,0.9999255
541,541,"Там невыносимо душно, умещается всего 3 человека, естественно ни о каких масках от коронавируса, безопасности, уважении клиентов даже и речи не идёт.",5.5606448e-05,2.3340708e-05,0.9999211
542,542,"Сотрудница, которая помогала с открытием счета, вела себя так, что по ее виду было понятно, что тебя здесь явно не ждали, разговаривала очень раздраженно и всякий раз делала вид, что меня рядом нет.",5.2685897e-05,2.8268043e-05,0.99991906
543,543,Не за что на свете не связывайтесь с этим банком!,4.624772e-05,2.5940044e-05,0.99992776
544,544,"Добрый день, отвратительный банк, дозвониться до ипотечного центра просто НЕВОЗМОЖНО!!!!",4.13693e-05,2.5005895e-05,0.9999336
545,545,"Вывод: для привлечения клиентов в банк умышленно обманывает их несуществующими услугами, использует ложную рекламу.",4.802896e-05,2.5221416e-05,0.9999267
546,546,"Хочу сказать спасибо сотруднику чата альфа банка Виктории, за то что смогла успокоить меня, быстро и по делу проконсультировала.",4.2321302e-05,0.99989986,5.7802798e-05
547,547,"Расчетный счет в Банке с 2018 года, в целом все устраивает.",0.0002306224,0.99974674,2.2703383e-05
548,548,Уже почти час не могу связаться!,4.673274e-05,2.8559907e-05,0.99992466
549,549,"Сотрудницы профессиональны, вежливы, всегда идут навстречу клиентам.",5.1723357e-05,0.9999124,3.5906804e-05
550,550,"Нашла машину спустя три недели почти, активировала кредит, деньги сразу же поступили на мой счёт, сняла их в банкомате без комиссии , что то же кстати редкость, купила машину.",0.75250506,0.24395768,0.0035372276
551,551,"Первые впечатления, это действительно то, что быстро, доступно, понятно и удобно.",5.9721086e-05,0.99989974,4.052454e-05
552,552,"Т.е. это было уже третье отделение Сбербанка, где я не то что получить, даже заказать деньги не смогла.",5.448597e-05,2.5154144e-05,0.99992037
553,553,Мы ждали и через 50 дней деньги нам не вернули и счет не закрыли.,5.2144846e-05,2.3918408e-05,0.99992394
554,554,"И снова возле электронной очереди стоит руководитель и говорит, что программа не работает и не даёт брать талоны.",6.0583745e-05,2.5195664e-05,0.99991417
555,555,"После моего звонка менеджеру, услышал просто невообразимое: ""Вас забыли предупредить, что курьера на сегодня нет.",7.111207e-05,2.3504543e-05,0.99990535
556,556,"Заходила неоднократно в отделение ВТБ г. Реутова, Ленина, 4.",0.9996074,0.0002473891,0.00014529892
557,557,"02.04.2018 при личном посещении офиса ВТБ в г. Иваново на пр. Шереметьевский, представитель банка мне объяснил, что предложение под этот процент действует только при условии обязательного страхования.",0.99962556,0.00024811595,0.00012625946
558,558,Ещё и законодательство в области добровольного заключения соглашений и договоров банком было грубейшим образом проигнорировано.,7.59647e-05,2.7844202e-05,0.99989617
559,559,"Вся эта ситуация и отклики по всей России о подобных случаях привели меня просто в ужас от того, что скрывается под брендом ""Сбербанка"".",6.659754e-05,3.044028e-05,0.99990296
560,560,Будьте счастливы со своим новым агрегатором.,0.9990637,0.00053854205,0.00039779002
561,561,Никому не советую связываться с этим банком.,4.2057734e-05,3.015918e-05,0.99992776
562,562,"Прошу банк, не мешайте мне совершать операции и я буду с вами сотрудничать, ведь мне с Вами удобно, решите вопрос с сотрудниками офиса по улице 60 лет октября в г. Оренбурге, НАДОЕЛО!",6.43271e-05,2.7468328e-05,0.9999082
563,563,"Работники доп. отделений, несмотря на свой довольно молодой возраст, тоже порадовали своим профессионализмом и вежливостью, проблем с получением или сроками зачисления платежей у меня тоже не возникало.",5.6041867e-05,0.99990463,3.9344133e-05
564,564,Очень хорошо проконсультировали и ответили на все вопросы!,5.227488e-05,0.9999112,3.6475165e-05
565,565,"Сотрудники банка (офис в Нижнем Новгороде) вообще охамели, говорят, что это мои проблемы, что их клиенты задолжали деньги банку.",6.205685e-05,3.005281e-05,0.99990785
566,566,"Сегодня уже надо на работу, заеду завтра.",0.99923015,0.00058765686,0.00018222729
567,567,"Хотелось бы выразить благодарность сотрудникам и руководству банка за оперативную работу, за тактичность.",4.2931657e-05,0.9998851,7.19422e-05
568,568,"Уверен, когда будет нужно - все равно откажут в выдаче!5.",0.00013803248,3.450934e-05,0.9998274
569,569,А кататься невозможно - я же работаю в другом городе.,0.00011788183,2.7059348e-05,0.99985504
570,570,"Мы с ней взаимодействуем уже не первый раз, и каждый раз я поражаюсь ее положительному настрою.",8.619801e-05,0.99986875,4.50228e-05
571,571,"Сотрудница офиса меня просто туда не впустила, ВНИМАНИЕ, потому что я была с детской коляской!",0.00013127511,2.8059743e-05,0.9998406
572,572,Хотела бы выразить благодарность Банку и сотрудникам за отличный сервис.,4.7887603e-05,0.999887,6.512794e-05
573,573,Ни в одном другом банке нет такого безобразного отношения к клиентам.,4.1461466e-05,2.7438848e-05,0.9999311
574,574,"Я и раньше получал переводы, но у банков это постоянно вызывает какую-то трудность: то денег в кассе нет, то программа не работает, то еще какие-то проблемы.",4.7815025e-05,3.4168763e-05,0.999918
575,575,"Идет и возвращает деньги (брал 50 000 руб., меньше не дали), оплачивает пеню в размере 3 000 руб. Его просят прийти через неделю за справкой о закрытии кредита.",0.99900013,0.00029895682,0.0007009514
576,576,"Электронная очередь, больше половины операционных мест работают одновременно и безостановочно, так что очередь подошла быстро.",6.318837e-05,0.9998945,4.231131e-05
577,577,"Чем довольна: отличный кол-центр, не сравнить ни с одним банком, реально люди занимаются твоими вопросами!",6.962006e-05,0.99986124,6.909955e-05
578,578,Начала вести себя некомпетентно и непрофессионально.,4.921551e-05,2.49316e-05,0.99992585
579,579,"Например, если по каким-то причинам уже нереально разблокировать функционал для работы с картой в интернет-банке до получения новой, то можно, например, сделать ускоренный перевыпуск и доставку новой карты курьером.",0.6044673,0.0010639364,0.39446875
580,580,"Это не первый банк, в котором я обслуживаюсь и где получала зарплату, но как по мне самый достойный!",0.0008589036,0.9984907,0.000650338
581,581,"Да, про солнечный... Погода была – супер!",0.00027455023,0.99966264,6.282974e-05
582,582,Просто отлично - клиент должен приходить и еще делать работу сотрудников банка!,7.911461e-05,3.104967e-05,0.99988985
583,583,"!страховки разных компаний,и услуга Сертификат Юрист 24,о которой мне даже не сказали,я пошла через день в банк,и написала заявлении о расторжении договора с этой компании,у меня его приняла сотрудница банка,но через 10 дней она же мне позвонила,и сообщила,что по техническим причинам они не смогли это сделать,и попросила мне самой обратиться к ним,это вообще возмутительный кошмар!!!",4.6031786e-05,2.3640758e-05,0.9999304
584,584,"Если вы предоставляете услуги то прошу наладить контакты ,активные почты(чтобы хотя бы отвечали в 3 рабочих днЯ), нормальных операторов - они ни чего не знают ,помочь не могут , молчат и все чувствуешь себя простите каким-то дурачком.",3.7911777e-05,2.8403601e-05,0.9999337
585,585,Поскольку сайт просто не пускает!,8.919486e-05,3.3920966e-05,0.99987686
586,586,"Вывод: для привлечения клиентов в банк умышленно обманывает их несуществующими услугами, использует ложную рекламу.",4.802896e-05,2.5221416e-05,0.9999267
587,587,"Это не просто сервис, это отсутствие сервиса!",4.0503364e-05,2.7429873e-05,0.99993205
588,588,Отношение к клиенту доброжелательное.,6.9399095e-05,0.9999,3.0655654e-05
589,589,Абсолютная некомпетентность сотрудников банка и нежелание как то помочь клиенту.,3.7466816e-05,2.861134e-05,0.99993396
590,590,"Квалификации у сотрудников нет, не советую обращаться в данный банк.",4.566766e-05,2.533294e-05,0.99992895
591,591,"Супер, только я уже уехал из центра, ну ладно, очень уж хочется мне попробовать до выходных.",0.9992902,0.00032732668,0.0003824385
592,592,"ПАО СбербанкУважаемый Сбербанк, вы серьезно препятствуете работе бизнеса на основании подозрений??",6.078532e-05,2.8693383e-05,0.9999105
593,593,"Затем возвращается, сообщая, что секретарь на обеде, приходите в 14:00 – это еще через 20 минут (в режиме работе указано, что работают без перерывов).",9.213972e-05,7.3341056e-05,0.99983454
